[
  {
    "id": "NB-001",
    "lens": "naming-and-boundaries",
    "revision": "740976ecf80a4f2ccdaa611d7790ccaa95b48773",
    "subject": {
      "kind": "config",
      "identity": "scripts/check-imports.sh:39 SUB_PACKAGES"
    },
    "category": "architecture",
    "title": "The flat-sibling rule enforces a hardcoded six-package list that has not kept pace with the ten domain siblings that now exist; dhpricing already imports dhlisting uncaught",
    "severity": "high",
    "confidence": "strong",
    "evidence": [
      {
        "claim": "The flat-sibling rule is enforced against a hardcoded list of exactly six packages.",
        "command": "grep -n 'SUB_PACKAGES=' scripts/check-imports.sh",
        "output": "39:SUB_PACKAGES=\"arbitrage portfolio tuning finance export dhlisting\"",
        "file_line": "scripts/check-imports.sh:39"
      },
      {
        "claim": "internal/domain/ actually contains 24 packages, of which demand, dhevents, dhpricing, liquidation, psacampaign and intelligence are inventory-siblings absent from the enforced list.",
        "command": "git ls-files 'internal/domain' | awk -F/ 'NF>3{print $3}' | sort -u | tr '\\n' ' '",
        "output": "advisor ai arbitrage auth constants demand dhevents dhlisting dhpricing errors export finance intelligence inventory liquidation llmutil mathutil observability portfolio pricing psacampaign scoring storage timeutil tuning"
      },
      {
        "claim": "internal/domain/dhpricing imports sibling internal/domain/dhlisting in two production files. The check passes only because dhpricing is not in SUB_PACKAGES.",
        "command": "git grep -n 'domain/dhlisting' -- 'internal/domain/dhpricing/*.go'",
        "output": "internal/domain/dhpricing/service.go:7:\t\"github.com/guarzo/slabledger/internal/domain/dhlisting\"\ninternal/domain/dhpricing/service_test.go:9:\t\"github.com/guarzo/slabledger/internal/domain/dhlisting\"\ninternal/domain/dhpricing/types.go:11:\t\"github.com/guarzo/slabledger/internal/domain/dhlisting\"",
        "file_line": "internal/domain/dhpricing/service.go:7"
      },
      {
        "claim": "demand, dhpricing and psacampaign import internal/domain/inventory in production files, i.e. they occupy the same structural position as the six enforced siblings.",
        "command": "for p in demand dhpricing psacampaign; do printf '%s %s\\n' \"$p\" \"$(git grep -l 'domain/inventory' -- \"internal/domain/$p/*.go\" | grep -cv _test)\"; done",
        "output": "demand 2\ndhpricing 2\npsacampaign 1"
      }
    ],
    "searched_universe": "git ls-files 'internal/domain' and git ls-files 'internal/domain/<pkg>/*.go' at the baseline revision; scripts/check-imports.sh read in full.",
    "exclusions": [
      "Did not evaluate whether dhpricing -> dhlisting is architecturally wrong on its merits, only that the declared rule does not cover it."
    ],
    "proposed_fix": "Derive SUB_PACKAGES from the filesystem (every directory under internal/domain/ that imports internal/domain/inventory) rather than hardcoding six names, so the rule cannot silently stop covering new packages. Then decide explicitly whether dhpricing -> dhlisting is an intended exception (and record it as one) or a violation to be broken by moving the shared types into inventory or a leaf package.",
    "blast_radius": [
      "scripts/check-imports.sh",
      "internal/domain/dhpricing/service.go",
      "internal/domain/dhpricing/types.go",
      "make check / CI"
    ],
    "effort": "S",
    "acceptance_criteria": [
      "scripts/check-imports.sh derives its sibling list from the repository layout, and adding a new directory under internal/domain/ that imports inventory brings it under the rule with no edit to the script.",
      "bash scripts/check-imports.sh exits 0, and the dhpricing -> dhlisting edge is either removed or listed in an explicit, commented allowlist in the script."
    ]
  },
  {
    "id": "NB-002",
    "lens": "naming-and-boundaries",
    "revision": "740976ecf80a4f2ccdaa611d7790ccaa95b48773",
    "subject": {
      "kind": "package",
      "identity": "internal/domain/tuning"
    },
    "category": "naming",
    "title": "The package named `tuning` contains no tuning logic: all 902 LOC of tuning computation and every tuning type live in `inventory`, consumed by nothing but the 162-LOC `tuning` package",
    "severity": "high",
    "confidence": "strong",
    "evidence": [
      {
        "claim": "internal/domain/tuning is a single 162-line file whose only exported surface is a Service interface with one method that returns an inventory type.",
        "command": "git ls-files 'internal/domain/tuning/*.go' | grep -v _test | xargs wc -l && grep -nE '^(func|type)' internal/domain/tuning/service.go",
        "output": "162 internal/domain/tuning/service.go\n14:type Service interface {\n18:type service struct {\n25:func NewService(\n37:func (s *service) GetCampaignTuning(ctx context.Context, campaignID string) (*inventory.TuningResponse, error) {",
        "file_line": "internal/domain/tuning/service.go:14"
      },
      {
        "claim": "The four tuning-named files inside internal/domain/inventory total 902 lines and hold every Compute* entry point plus all ten tuning types.",
        "command": "wc -l internal/domain/inventory/tuning.go internal/domain/inventory/tuning_analytics.go internal/domain/inventory/tuning_stddev.go internal/domain/inventory/tuning_types.go | tail -1",
        "output": "  902 total",
        "file_line": "internal/domain/inventory/tuning.go:62"
      },
      {
        "claim": "Every one of those seven tuning entry points is referenced from exactly one file outside internal/domain/inventory, and it is internal/domain/tuning/service.go.",
        "command": "git grep -lE '\\b(ComputeRecommendations|ComputePriceTierPerformance|ComputeBuyThresholdAnalysis|ComputeROIStats|EnrichPriceTierStddev|ComputeCardPerformance|EnrichCardPerformance)\\b' -- '*.go' ':!internal/domain/inventory'",
        "output": "internal/domain/tuning/service.go"
      },
      {
        "claim": "The Phase 1 reference map independently records external_refs == 1 and name_ambiguous false for the tuning entry points.",
        "command": "jq -r '.records[] | select(.identity==\"github.com/guarzo/slabledger/internal/domain/inventory.ComputeRecommendations\" or .identity==\"github.com/guarzo/slabledger/internal/domain/inventory.ComputeBuyThresholdAnalysis\" or .identity==\"github.com/guarzo/slabledger/internal/domain/inventory.ComputeROIStats\") | \"\\(.identity) refs=\\(.external_refs) amb=\\(.name_ambiguous // false)\"' docs/audit/maps/go-reference-map.json",
        "output": "github.com/guarzo/slabledger/internal/domain/inventory.ComputeRecommendations refs=1 amb=false\ngithub.com/guarzo/slabledger/internal/domain/inventory.ComputeBuyThresholdAnalysis refs=1 amb=false\ngithub.com/guarzo/slabledger/internal/domain/inventory.ComputeROIStats refs=1 amb=false"
      },
      {
        "claim": "The cluster's only dependencies on the rest of inventory are five shared types, all of which stay behind: Campaign, Phase, Purchase, Sale (types_core.go), CampaignPNL/ChannelPNL/DailySpend (analytics_types.go) and MarketSnapshot (service.go).",
        "command": "git grep -nE '\\b(CampaignPNL|ChannelPNL|DailySpend|MarketSnapshot|Campaign|Phase|Purchase|Sale)\\b' -- 'internal/domain/inventory/tuning*.go' | grep -v _test | wc -l",
        "output": "66"
      }
    ],
    "searched_universe": "All git-tracked *.go at the baseline revision, both default and integration build tags; intra-package coupling computed over the 67 non-test .go files of internal/domain/inventory.",
    "exclusions": [
      "inventory.PurchaseWithSale and inventory.TuningResponse are excluded from the move set: PurchaseWithSale is the shared analytics row type used by arbitrage, portfolio and the postgres store, and TuningResponse is a JSON API contract consumed by the handler layer.",
      "ComputeMarketAlignment is name_ambiguous in the repo (a same-named, unrelated function exists at internal/domain/scoring/factors.go:69); it is included here on the strength of its qualified call site inventory.ComputeMarketAlignment at internal/domain/tuning/service.go:135, not on a raw count."
    ],
    "proposed_fix": "Move tuning.go, tuning_analytics.go, tuning_stddev.go, tuning_types.go (and their tests) into internal/domain/tuning/, leaving only genuinely shared types in inventory. This follows the established flat-sibling pattern exactly: tuning already imports inventory, and no new sibling-to-sibling edge is created. Keep TuningResponse in inventory (or move it and update the handler import) — that is the one decision the mover must make consciously.",
    "blast_radius": [
      "internal/domain/inventory/tuning*.go",
      "internal/domain/tuning/service.go",
      "internal/testutil/mocks/tuning_service.go",
      "internal/adapters/httpserver/handlers (TuningResponse only)"
    ],
    "effort": "M",
    "acceptance_criteria": [
      "go build ./... and go test -race ./... pass after the move.",
      "bash scripts/check-imports.sh passes: internal/domain/tuning imports only inventory and observability, and no other sibling imports tuning.",
      "git grep -lE '\\bCompute(Recommendations|PriceTierPerformance|BuyThresholdAnalysis|CardPerformance)\\b' -- 'internal/domain/inventory/*.go' returns empty."
    ]
  },
  {
    "id": "NB-003",
    "lens": "naming-and-boundaries",
    "revision": "740976ecf80a4f2ccdaa611d7790ccaa95b48773",
    "subject": {
      "kind": "package",
      "identity": "internal/domain/inventory (suggestion*.go cluster)"
    },
    "category": "architecture",
    "title": "The 919-LOC campaign-suggestions cluster has zero inbound references from the rest of `inventory` and exactly one consumer package — a clean, isolated seam",
    "severity": "high",
    "confidence": "strong",
    "evidence": [
      {